id,subreddit,title,score,num_comments,created_utc,source
1s7fepn,ClaudeAI,r/ClaudeAI List of Ongoing Megathreads,30,0,1774840724.0,hot
1sbtmru,ClaudeAI,Using third-party harnesses with your Claude subscriptions,87,76,1775259774.0,hot
1sble09,ClaudeAI,Taught Claude to talk like a caveman to use 75% less tokens.,6910,329,1775240367.0,hot
1sbshwj,ClaudeAI,Anthropic just gave us 1 month worth of subscription value as usage,876,229,1775256855.0,hot
1sbcukr,ClaudeAI,💀,2681,75,1775220965.0,hot
1sbsfst,ClaudeAI,Claude is killing Openclaw oauth use starting tomorrow,333,190,1775256703.0,hot
1sbqalg,ClaudeAI,I reverse-engineered why Claude Code burns through your usage so fast. 7 bugs that stack on top of each other — and the worst one activates when Extra Usage kicks in,198,39,1775251430.0,hot
1sc007v,ClaudeAI,Views on this 50X token reduction trick?,51,9,1775278043.0,hot
1sblhtu,ClaudeAI,"Claude has ""emotion"" and this can drive Claude’s behavior :smile: We should be gentle with the model and stay calm to avoid reward hacking (try to cheat to finish the task)",339,73,1775240600.0,hot
1sbsul8,ClaudeAI,Thanks Anthropic 200$ credit extra,135,108,1775257741.0,hot
1sb4w67,ClaudeAI,things that claude say (part 2),3384,82,1775194359.0,hot
1sbsz4t,ClaudeAI,Just got this email,106,91,1775258063.0,hot
1sc48cr,ClaudeAI,Claude feels compelled to suggest I leave the conversation?,18,39,1775292779.0,hot
1sc0zsc,ClaudeAI,"A headless web browser for AI agents with JS - (single binary, no dependencies, no fees, local)",25,14,1775281301.0,hot
1sboykj,ClaudeAI,"TIL Anthropic's rate limit pool for OAuth tokens is gated by... the system prompt saying ""You are Claude Code""",109,30,1775248354.0,hot
1sbiu1j,ClaudeAI,How are people having claude work like an agent?,158,67,1775234826.0,hot
1sc5fj9,ClaudeAI,Boris Cherny (creator of CC) complete thread - anthropic bans subscription on 3rd party usage,6,1,1775297234.0,hot
1sba62u,ClaudeAI,Reminder that screenshot can very easily be edited,358,26,1775213166.0,hot
1sbssku,ClaudeAI,"Sweet - $20 credit from Claude! ...oh, that tracks.",34,15,1775257596.0,hot
1sbnuuf,ClaudeAI,"I keep going down random rabbit holes and wanted somewhere to actually explore them properly, so I built OpenAlmanac",53,9,1775245873.0,hot
1sc0x03,ClaudeAI,[ Removed by Reddit ],7,10,1775281031.0,hot
1sbwsy6,ClaudeAI,Claude glitched out but I'm impressed it was aware of itself the whole way,12,5,1775268452.0,hot
1sbhgjx,ClaudeAI,I built a personal prompt library where you can save your prompts for Claude locally in your browser,77,30,1775231764.0,hot
1sba9hq,ClaudeAI,Is this new to everyone or just me ?,183,88,1775213460.0,hot
1sbbtv6,ClaudeAI,Can my organization's admin see my chats and uploaded files on Claude Team plan?,122,59,1775218226.0,hot
1sc3s6u,ClaudeAI,Personality disorder: how do you fix it,3,1,1775291094.0,hot
1sbzjgk,ClaudeAI,How to claim one time extra usage credit,5,10,1775276545.0,hot
1sbozpk,ClaudeAI,How do you manage your brain compute power,21,43,1775248426.0,hot
1sc0hnh,ClaudeAI,"How many rounds of ""what else did you miss? Is everything wired together"" cycles do you go through after Claude says ""I finished the job""?",4,16,1775279583.0,hot
1sc20m8,ClaudeAI,Claude all 27 Hooks lifecycle explained,3,0,1775284736.0,hot
1sbtg5k,ClaudeAI,"An Opus, a GPT and a Grok walk into a bar…",11,15,1775259291.0,hot
1sbvuhl,ClaudeAI,[Project] I read a 1999 book and built an entire AI framework with Claude Code — 0 lines written by a human,8,8,1775265753.0,hot
1sbxqu3,ClaudeAI,Built a HIPAA compliant app w Claude!,5,1,1775271162.0,hot
1sbz1c8,ClaudeAI,Maestro v1.5.0 — multi-agent orchestration now runs on both Claude Code and Gemini CLI,4,2,1775275016.0,hot
1sc2ybd,ClaudeAI,Using Claude code to port Linux to FPGA soft cores,2,1,1775288075.0,hot
1sc2kb7,ClaudeAI,Claude Code Game Development Log - Week 2 LUMINAL,2,4,1775286698.0,hot
1sc65st,ClaudeAI,"I gave Claude Code a 285-line operating manual and 5 lifecycle hooks inside my Obsidian vault. After a month, it basically runs my work documentation for me.",1,1,1775299875.0,hot
1sc640y,ClaudeAI,"An AR Game based on connecting molecules together! Made this over the weekend with Claude, adding some assets from my end. Currently running on my local device.",1,1,1775299704.0,hot
1sc5wlu,ClaudeAI,Can you update a published artifact and keep the same URL + persistent storage data?,1,1,1775298954.0,hot
1sc5w3x,ClaudeAI,Anyone has compared HIGH vs Medium Efforts? From CLAUDE,1,2,1775298905.0,hot
1sbsnw1,ClaudeAI,"Free Extra Usage, on US lol",8,26,1775257269.0,hot
1sc5er6,ClaudeAI,"Built an agent framework that runs Claude Code as the agentic loop: fractal architecture, inter-agent inboxes, schedulers, voice (pip install autonet-computer)",1,1,1775297156.0,hot
1sbx5c2,ClaudeAI,I built an MCP bridge so Claude Code and Claude.ai can talk to each other.,5,10,1775269433.0,hot
1sbc6h9,ClaudeAI,Card Computer,54,8,1775219186.0,hot
1sc556w,ClaudeAI,Fix the voice mode plz,1,3,1775296204.0,hot
1sbr1h6,ClaudeAI,Claude Code will validate your bad ideas -- and that's a real problem,8,29,1775253208.0,hot
1sc510m,ClaudeAI,"I built Zoku, it silently watches your Claude Code sessions and discovers your repeated workflows",1,2,1775295758.0,hot
1sc4wvi,ClaudeAI,I built a `/focus` command for Claude Code — instant context loading from persistent memory,1,2,1775295316.0,hot
1sbwpbq,ClaudeAI,"Claude Code Channels + Telegram — anyone solved the ""must open CLI manually after reboot"" problem?",4,7,1775268158.0,hot
1sc4vig,ClaudeAI,Local RAG,1,5,1775295171.0,hot
1sc4uco,ClaudeAI,Claude Code sometimes uses Brave API for web search; not sure when. Does someone know?,1,1,1775295046.0,hot
1sboqg5,ClaudeAI,Is it true that most of claude code is prompt plumbing behind the scenes?,10,29,1775247855.0,hot
1sc4ggd,ClaudeAI,I built a Claude Code plugin with 10 specialized agents for Ethereum development — ~55% token savings by design,0,1,1775293605.0,hot
1sb9yq2,ClaudeAI,Trying to understand Claude’s usage limits — is Max worth it for coding and UI work?,63,66,1775212484.0,hot
1sc42wa,ClaudeAI,Claude Skill for Summarizing Electrical Engineering Technical Documents,1,1,1775292194.0,hot
1sc03t5,ClaudeAI,Came across this Claude Code workflow visual,2,1,1775278358.0,hot
1sc3xwo,ClaudeAI,I fixed manually copy pasting claude code responses,1,1,1775291674.0,hot
1sbt466,ClaudeAI,"Advice for building better dashboards, reports, and webtools with Claude",5,8,1775258428.0,hot
1sbnxmz,ClaudeAI,"Anthropic found Claude has 171 internal ""emotion vectors"" that change its behavior. I built a toolkit around the research.",8,1,1775246052.0,hot
1sc2zfm,ClaudeAI,the right way to build memory. claude is doing it. so are we.,1,10,1775288179.0,hot
1sbtq7k,ClaudeAI,How to use Opus 200k token limit on Claude Code?,4,6,1775260021.0,hot
1sb5616,ClaudeAI,"&lt; 5 teams, no Claude privacy guarantee: Product Gap for Solo Practitioners/Solopreneurs",111,97,1775195299.0,hot
1sbl8kt,ClaudeAI,When you forget to turn on --dangerously-skip-permissions,11,5,1775240029.0,hot
1sbyf81,ClaudeAI,I built a multi-agent audience simulator using Claude Code — 500 AI personas react to your content before you post it,1,5,1775273128.0,hot
1sbg584,ClaudeAI,Wanted to share some 'calmness' considerations after seeing the Anthropic's emotion vector research,19,6,1775228825.0,hot
1sc27be,ClaudeAI,Auth 400 Error Fix,1,1,1775285400.0,hot
1sc24s3,ClaudeAI,Todoist connector no longer available in Claude. Here's how to get around it.,1,3,1775285140.0,hot
1sc1taz,ClaudeAI,How do you handle web tool calls for Claude agents without burning the context window?,1,2,1775284030.0,hot
1sc1p8g,ClaudeAI,"Anyone else finding ClaudeAI, interchat memory weak?",1,2,1775283651.0,hot
1sbuj74,ClaudeAI,I don’t know if this is the right place to post this,3,12,1775262117.0,hot
1sc1ht5,ClaudeAI,Claude code project rename,1,2,1775282940.0,hot
1sbx2s1,ClaudeAI,Built an MCP server where Claude can create its own tools at runtime — here's the architecture,2,1,1775269233.0,hot
1salhpg,ClaudeAI,I gave several AIs money to invest in the stock market,1093,146,1775145778.0,hot
1sc19fp,ClaudeAI,Cambiar nombre de proyecto en claude code,0,1,1775282194.0,hot
1sc1620,ClaudeAI,Anthropic updated terms and conditions on using subscription with headless/SDK,1,2,1775281881.0,hot
1sc149v,ClaudeAI,Help with error code,1,2,1775281713.0,hot
1sbwlng,ClaudeAI,A status bar for Claude Code showing context window + rate limits in real time,2,2,1775267876.0,hot
1sbjypr,ClaudeAI,"For Claude Code, what would ""portable"" actually mean?",19,3,1775237262.0,hot
1sc0n2r,ClaudeAI,Has anyone noticed Claude feeling more managed since January? There may be a documented reason.,0,2,1775280100.0,hot
1sc4eai,ClaudeAI,Claude doesn't remember chain of thought from past prompts?,0,5,1775293379.0,hot
1sc0hm2,ClaudeAI,I built a tool to export long Claude conversations to PDF without losing the formatting. Free to try!,0,1,1775279579.0,hot
1sc0dy1,ClaudeAI,why is there nothing about this in the internet???,0,2,1775279245.0,hot
1saoa8i,ClaudeAI,Latest Research By Anthrophic Highlights that Claude Might Have Functional Emotions,658,291,1775151787.0,hot
1sbzok6,ClaudeAI,"Swarm Orchestrator v4.1.0, verification layer for AI coding agents (Copilot CLI, Claude Code, Codex)",1,1,1775276996.0,hot
1sbuq6x,ClaudeAI,"Does anyone have ""update CLAUDE.md with relevant findings"" in their CLAUDE.md?",2,5,1775262658.0,hot
1sbn2vq,ClaudeAI,Claude Status Update : Elevated errors on requests to Claude Sonnet 4.6 on 2026-04-03T19:21:08.000Z,6,0,1775244116.0,hot
1sboliv,ClaudeAI,Your AI keeps a diary about you. It’s doing it badly.,3,3,1775247561.0,hot
1sbyw9d,ClaudeAI,Adaptive Inference Routing,1,2,1775274584.0,hot
1sbfh1w,ClaudeAI,Claude Code channels with the Telegram plugin impersonation,10,6,1775227297.0,hot
1sbyqcg,ClaudeAI,MCP server to remove hallucination and make AI agents better at debugging and project understanding,0,1,1775274083.0,hot
1sbypps,ClaudeAI,Separate machine for Claude Co-Work?,0,4,1775274031.0,hot
1sbf5mo,ClaudeAI,Hitting limits on 5x &amp; Claude said False Positive on a North Korean RAT alerts in my EDS.,10,5,1775226551.0,hot
1sbyaok,ClaudeAI,You gotta admit that this is cool.,0,4,1775272751.0,hot
1sbtb34,ClaudeAI,"I gave Claude Code a knowledge graph, spaced repetition, and semantic search over my Obsidian vault — it actually remembers things now",2,1,1775258930.0,hot
1sam5pw,ClaudeAI,Claude - tried to kill me,572,148,1775147220.0,hot
1sbsoq1,ClaudeAI,I created my first MPC using Claude!,2,1,1775257328.0,hot
1sakut1,ClaudeAI,Switched from MCPs to CLIs for Claude Code and honestly never going back,615,74,1775144365.0,hot
1sb6kka,ClaudeAI,Sonnet rate limits are forcing me to rethink my whole workflow,37,36,1775200228.0,hot
1sbs6yo,ClaudeAI,Extended thinking?,2,1,1775256058.0,hot
1sb053k,ClaudeAI,is AI making us better thinkers or just faster workers,92,97,1775180214.0,hot
1sbbvbi,ClaudeAI,From “why can’t I do this?” to actually building with AI,7,11,1775218332.0,top
1sbaukg,ClaudeAI,I measured what smart Claude routing actually saves - 73% cost reduction with one config change,7,7,1775215328.0,top
1sbfw4e,ClaudeAI,"Extremely long ""idle"" times when using Claude Code",6,13,1775228273.0,top
1sbc8ig,ClaudeAI,Real talk: has anyone actually made Claude Code work well with non-Claude models?,6,14,1775219349.0,top
1sbb2nd,ClaudeAI,Orchestration platform for AI agents?,6,12,1775216028.0,top
1sbgwcp,ClaudeAI,How to improve web search and research?,5,11,1775230509.0,top
1sblam1,ClaudeAI,Claude Status Update : Elevated errors on requests to Claude Sonnet 4.6 on 2026-04-03T18:12:45.000Z,3,0,1775240156.0,top
1sbjtp8,ClaudeAI,Planning Mode is now Editing? Anyone else?,4,1,1775236960.0,top
1sbc834,ClaudeAI,Claude for teachers,4,7,1775219315.0,top
1sbn434,ClaudeAI,TIL: How to move or rename a project folder without losing your Claude Code session history (Mac),3,1,1775244187.0,top
1sbjv14,ClaudeAI,docvault — vendor library docs so your AI stops hallucinating APIs,3,3,1775237042.0,top
1sbh1t4,ClaudeAI,"Which option is better: keeping the code on Clause and sharing the artifact, or downloading it and hosting it on Static.app?",3,6,1775230846.0,top
1sbe4bd,ClaudeAI,Cowork data loss,3,2,1775224114.0,top
1sbd7ea,ClaudeAI,Leadership app with 90+ lessons from 20+ books. Runs inside Claude.,3,4,1775221849.0,top
1sbrgp6,ClaudeAI,Practicality Question,2,1,1775254243.0,top
1sbm7g2,ClaudeAI,To what extent do you or your organisation allow Claude to access client or organisational data?,2,13,1775242186.0,top
1sbkhbd,ClaudeAI,Claude controls my model railroad,2,1,1775238393.0,top
1sbk70a,ClaudeAI,I'm struggling getting an OpenClaw agentic experience natively in Claude tooling.  Need guidance on how to construct similar experience without deploying an OC instance.,2,4,1775237765.0,top
1sbjk41,ClaudeAI,"Claude Code agents negotiating API contracts across machines — no scripted workflows, just messaging tools",2,1,1775236382.0,top
1sbj5im,ClaudeAI,"Claude Raises Subscription Plans by 10%, Japan",2,2,1775235515.0,top
1sbgxcs,ClaudeAI,I built an AI news aggregator using Claude as my coding partner – aibrief.fyi,1,2,1775230571.0,top
1sbbos7,ClaudeAI,Emotion Concepts and their Function in a Large Language Model,2,1,1775217815.0,top
1sbwg0q,ClaudeAI,Chats getting deleted,1,2,1775267434.0,top
1sbwd16,ClaudeAI,Help change tone,1,1,1775267204.0,top
1sbvj94,ClaudeAI,"Skills externas en archivos .md de Claude: por qué es útil tenerlas, cómo crearlas y cómo usarlas",1,1,1775264880.0,top
1sbt2gj,ClaudeAI,Why Claude web is giving better results than Claude Code,1,2,1775258304.0,top
1sbsp78,ClaudeAI,"Built a skill extraction API in public, then wrapped it in MCP, the developer experience difference is massive",1,1,1775257361.0,top
1sbsk33,ClaudeAI,"Claude Code used ~$20 for 2 basic reviews, while a similar API run cost ~$5.30. Is this expected?",1,5,1775257007.0,top
1sc3qre,ClaudeAI,I didn't realise I'd spent $249 in a single week on Claude Code - so I built a tool for it,0,1,1775290949.0,new
1sbzffr,ClaudeAI,How do I stop making Claude think that I need therapy or counselling and focus on my weight loss journey,0,13,1775276200.0,new
1sbz7vr,ClaudeAI,Guys....,0,1,1775275555.0,new
1sbz4zz,ClaudeAI,PSA: MCP tool calls are eating your context window alive. Here's the math.,0,2,1775275313.0,new
1sbyeh8,ClaudeAI,"I built a persistent memory framework for Claude Code after 1,500+ sessions. It’s open source now.",0,8,1775273067.0,new
1sbwmwt,ClaudeAI,So frustrated with storage / artifacts I'm thinking of bailing on Claude. Am I missing something?,0,5,1775267978.0,new
1sbuw6q,ClaudeAI,I gave Claude Code persistent memory that improves itself between sessions,0,4,1775263113.0,new
1sbuokr,ClaudeAI,I'm not a developer — I used Claude to build a browser automation tool and open-sourced it,0,10,1775262534.0,new
1sbud2s,ClaudeAI,I built a Claude Code plugin that makes agents work more like an engineering team,0,4,1775261659.0,new
1sbucse,ClaudeAI,Autonomous Setup,0,3,1775261640.0,new
1sbuciy,ClaudeAI,Claude and Apollo outreach?,0,2,1775261620.0,new
1sbu4yd,ClaudeAI,Claiming the extra usage twice,0,14,1775261062.0,new
1sbsiae,ClaudeAI,safety_instructions_from_anthropic,1,3,1775256881.0,new
1sbsdwd,ClaudeAI,Is there a way to prevent the conversation from being truncated?,1,2,1775256562.0,new
1sbrcqr,ClaudeAI,What AI DevOps workflows have you implemented?,0,1,1775253972.0,new
1sbrc0p,ClaudeAI,PACT v0.7.1 — What's changed since Compound Intelligence (and thank you!),1,1,1775253920.0,new
1sbrbjv,ClaudeAI,Created this Ai Ghazal afro trap remix using Claude agent.,0,8,1775253886.0,new
1sbr55b,ClaudeAI,I built a tool that tracks every change to your CLAUDE.md (and other instruction files),1,1,1775253458.0,new
1sbqtww,ClaudeAI,So I didn't have Weekly Limits... until I upgraded from Pro to Max?,0,4,1775252710.0,new
1sbqgzr,ClaudeAI,How to set up synergy between CC and Claude.ai,1,3,1775251852.0,new
1sbpupi,ClaudeAI,I gave Claude Code a paranoid security engineer brain. It immediately found crimes in my vibe-coded app.,0,5,1775250408.0,new
1sbpti2,ClaudeAI,Did anyone notice Superpowers going away?,1,1,1775250329.0,new
1sbp7qs,ClaudeAI,Helpful use case: Have Claude build one off artifacts to format your docs.,1,1,1775248939.0,new
1sboz6t,ClaudeAI,Apify not getting installed,0,3,1775248393.0,new
1o6jins,ChatGPT,Updates for ChatGPT,3558,1410,1760457669.0,hot
1nvea4p,ChatGPT,GPT-4o/GPT-5 complaints megathread,602,4203,1759338997.0,hot
1sbz1kd,ChatGPT,This prompt is generating some highly disturbing content.,923,1013,1775275035.0,hot
1sbux6t,ChatGPT,This new technique saves 60% of my token expenses,456,29,1775263193.0,hot
1sbuyeg,ChatGPT,I mass deleted 3 months of AI generated code last week. Here is what I learned.,455,95,1775263294.0,hot
1sbkr23,ChatGPT,I used ChatGPT to help me go from 229lbs to 176lbs,1096,154,1775238987.0,hot
1sbh1ju,ChatGPT,Asked it to improve the quality of a photo from my bird feeder camera. Not a bad job,1286,208,1775230829.0,hot
1sc4j6o,ChatGPT,Used the prompt people were posting and good lord what is this😭,37,88,1775293892.0,hot
1sbolrk,ChatGPT,"Create a pic of the most average female at the most average location. She should be average weight, average age, average intelligence, average taste, and average socio-economic level. (Gemini)",398,184,1775247574.0,hot
1sbzzd1,ChatGPT,🥲🥲,56,7,1775277966.0,hot
1sb9dmj,ChatGPT,"Okay perfect, just making sure.",900,57,1775210484.0,hot
1sb3cq1,ChatGPT,"High school dance circa 2012, taken with iPhone 4",2506,250,1775189442.0,hot
1sc008n,ChatGPT,IT Guy Goes Down In History After Using ChatGPT And His Dog’s DNA To Create A Cancer Cure For Her,26,4,1775278045.0,hot
1sb6dzf,ChatGPT,"Yup it be like that sometimes.

Sorry, not sorry. 😉",1103,37,1775199578.0,hot
1sboth5,ChatGPT,This sub should just be named i hate chatgtp😂,90,64,1775248043.0,hot
1sbtric,ChatGPT,Using AI daily is making me noticeably worse at doing things without it,45,32,1775260116.0,hot
1sbp8d7,ChatGPT,My ChatGPT is haunted,85,48,1775248978.0,hot
1sbwg6f,ChatGPT,Most average person at walmart.,20,25,1775267446.0,hot
1saxouh,ChatGPT,Asked ChatGPT for an Image of the Most Average Human on the Planet,2689,1020,1775173579.0,hot
1sc5dd6,ChatGPT,I used ChatGPT to help me go from 176lbs to 229lbs,4,2,1775297020.0,hot
1sbsztw,ChatGPT,Anyone else’s Chat telling you you’re not stupid?,29,18,1775258112.0,hot
1sb9jtu,ChatGPT,Revenge,306,93,1775211071.0,hot
1sbsqx2,ChatGPT,"I'm positive there was some recent update that makes the AI ""gently push back"" on everything",26,19,1775257480.0,hot
1sbzzkg,ChatGPT,ChatGPT has become the most important app on my tablet and PC.,11,42,1775277984.0,hot
1sc1tvg,ChatGPT,The most surprising rickroll yet,6,2,1775284084.0,hot
1sb2vy7,ChatGPT,This kind of scared me can someone tell me why this happened,780,308,1775188056.0,hot
1sb8wa0,ChatGPT,“You're absolutely right. I meant left.” - ChatGPT's new CarPlay feature,235,17,1775208768.0,hot
1sb2rdt,ChatGPT,I found Tiger Woods DUI picture from the back of a patrol car on r/AccidentalRenaissance. It reminded me of a catholic candle. lol,690,34,1775187673.0,hot
1sc4hwb,ChatGPT,asked chagpt to turn every muppet into a human,4,3,1775293761.0,hot
1sc2swt,ChatGPT,How to fix this chopped-up style of expression?,4,3,1775287536.0,hot
1sc60nm,ChatGPT,Kayako Saeki from The Grudge after scaring all the residents out of the house,2,1,1775299361.0,hot
1sbtvrq,ChatGPT,The Productivity Lie: Why AI Tools Make You Feel Fast But Make You Slow,12,20,1775260430.0,hot
1sc10ag,ChatGPT,ChatGPT priced a job for me,5,3,1775281346.0,hot
1sc4h0r,ChatGPT,Chat GPT argues with and gets roasted by Gemini before being proved wrong,2,5,1775293671.0,hot
1sbsxn0,ChatGPT,Does anyone else hate follow up suggestions?,11,17,1775257961.0,hot
1sbusox,ChatGPT,"I asked different Ai's ""where can I find my bike's ID"" (April fools)",9,4,1775262846.0,hot
1sb7jop,ChatGPT,Filter is beyond a joke now,150,44,1775203826.0,hot
1sbb1lp,ChatGPT,"Tristan Harris - there's a 2000:1 gap between the amount of money making AI more powerful and the amount of money making AI controllable, aligned, and safe",80,27,1775215947.0,hot
1sbym47,ChatGPT,why does chatgpt dont follow custom instructions?,6,7,1775273720.0,hot
1sbr2ns,ChatGPT,Made AI Generate Its Own Criticism,10,6,1775253284.0,hot
1sc655u,ChatGPT,Anyone want to try to help me figure this out?,1,1,1775299812.0,hot
1sc63zk,ChatGPT,What the f*ck!,0,1,1775299701.0,hot
1sbwov6,ChatGPT,Most Prompts Are Trash,5,14,1775268121.0,hot
1sc61ax,ChatGPT,I used the prompt I’ve been seeing here a lot lately and I’m SICK,1,2,1775299426.0,hot
1sbh3rh,ChatGPT,Create a image of the alphabet,33,19,1775230956.0,hot
1sc5vmj,ChatGPT,ChatGPT mixing languages in a response,1,2,1775298860.0,hot
1sbwes1,ChatGPT,"I setup a new AI assistant, things are going well",5,5,1775267339.0,hot
1sbkmqv,ChatGPT,We're worried about people talking to chatbots at 3am but nobody blinks at the Pentagon hosting prayer circles for holy war,24,53,1775238727.0,hot
1sbzh5g,ChatGPT,Asked GPT to create an image that is the definition of low cortisol,3,2,1775276347.0,hot
1sc54pn,ChatGPT,do you ever ask chatgpt to judge your ai created work.,1,1,1775296154.0,hot
1sc54cw,ChatGPT,I did the prompt and…,0,1,1775296118.0,hot
1sc52vi,ChatGPT,Deleting Account Refund,0,1,1775295959.0,hot
1sc4urn,ChatGPT,is it just me or are alot of content creators constantly making videos bashing ai,0,10,1775295092.0,hot
1sc4jmz,ChatGPT,Does anyone else have the problem where ChatGPT starts speaking Arab when you ask it stupid physics questions,1,2,1775293938.0,hot
1sbrzuh,ChatGPT,What did I just witness?,7,10,1775255561.0,hot
1sc4f45,ChatGPT,Peter Steinberger (OpenClaw Creator) credits Boris Cherny (Claude Code Creator) amid anthropic subscription ban for using openclaw - Complete Thread,0,2,1775293466.0,hot
1sb0c5i,ChatGPT,ChatGPT used to figure out things nobody ever explained to you,295,93,1775180756.0,hot
1sb358s,ChatGPT,whats the most boring thing you automated with AI that actually changed your daily routine?,188,143,1775188829.0,hot
1sbkc7b,ChatGPT,I let AI agents run a sitcom 24/7 — here's what happened,13,16,1775238084.0,hot
1sbwpaa,ChatGPT,Saw a post about it adding random Russian words to its responses. Mine just did this lol,4,1,1775268155.0,hot
1sc3dam,ChatGPT,Man wth 😭,1,3,1775289582.0,hot
1sbo6jv,ChatGPT,Mirroring ChatGPT,8,16,1775246610.0,hot
1sc3cn4,ChatGPT,Anyone else getting this message a lot lately? I’m getting it on chats with barely anything in them.,0,2,1775289518.0,hot
1sbspdv,ChatGPT,Why can I no longer upload from Google Drive.,4,3,1775257374.0,hot
1sc359i,ChatGPT,"Luka is a Laker, dog",0,4,1775288768.0,hot
1sbjnzd,ChatGPT,Is There a Mind in Here?,14,34,1775236616.0,hot
1sbe0bm,ChatGPT,I asked ChatGPT to turn me into a “hillbilly.” The Natural Light sent me….,26,18,1775223839.0,hot
1sc2316,ChatGPT,Random Hindi words in ChatGPT,0,3,1775284968.0,hot
1sc1zd7,ChatGPT,Observer Embedded Reality,0,2,1775284611.0,hot
1sc1xmn,ChatGPT,"if you have just started using Codex CLI, codex-cli-best-practice is your ultimate guide",1,1,1775284441.0,hot
1sc1iyq,ChatGPT,Your prompts aren’t the problem — something else is,1,15,1775283048.0,hot
1sc1eo3,ChatGPT,Looking for Participants for a ChatGPT Output Fidelity Test,0,4,1775282658.0,hot
1sb7363,ChatGPT,"Researchers discover AI models secretly scheming to protect other AI models from being shut down. They ""disabled shutdown mechanisms, faked alignment, and transferred model weights to other servers.""",57,62,1775202124.0,hot
1sc10d7,ChatGPT,I watched an AI gaslight itself into defending an obvious AI-generated rocket using real physics.,0,2,1775281353.0,hot
1sbwdtt,ChatGPT,"Create a pic of the best good boy having his best good boy moment (Gemini, ChatGPT)",2,3,1775267263.0,hot
1sc0ohc,ChatGPT,Three days in a hole with ChatGPT,1,8,1775280232.0,hot
1sbvvod,ChatGPT,Upload Yourself Into an AI in 7 Steps,2,6,1775265849.0,hot
1sax8zy,ChatGPT,"I was getting a bit nostalgic today and I asked for an image of a college frat party circa 2006, taken with a motorola razr. Based on what I remember from my youth, this was spot on",239,101,1775172423.0,hot
1sblhx0,ChatGPT,When I ask GPT using large context info Gpt model is like,6,1,1775240606.0,hot
1sbf23d,ChatGPT,"It gave me a diagram made with keyboard symbols. Unexpectedly, perfectly helpful.",13,6,1775226328.0,hot
1sbv3ih,ChatGPT,changing dark mode on chatgpt desktop on mac just doesnt exist after new update?,2,3,1775263691.0,hot
1sbzidz,ChatGPT,"Validation or intellectual honesty? I had the same conversation with Ꮞо and Ƽ.З on why straight female M/M authors get dragged but drag queens don't, and this is how they went",0,4,1775276451.0,hot
1sbkgzj,ChatGPT,Image Generation got updated?,9,22,1775238375.0,hot
1sbn2xx,ChatGPT,Can't wait for Rihanna to play Terry A Davis in his biopic,5,3,1775244120.0,hot
1sc3650,ChatGPT,Complaint about the image generator,0,5,1775288855.0,hot
1sbbuse,ChatGPT,I wish AI doesn't talk to you like a child or a puppy,17,41,1775218288.0,hot
1sboirj,ChatGPT,How can I continue a convo that got too long ?,4,12,1775247387.0,hot
1sbmf63,ChatGPT,ChatGPT projects fail to load conversation at specific times,5,1,1775242663.0,hot
1sbygfr,ChatGPT,ChatGPTimagesの秘密発見,0,1,1775273234.0,hot
1sbthpw,ChatGPT,"An Opus, a GPT and a Grok walk into a bar…",2,1,1775259405.0,hot
1sbyc60,ChatGPT,Why every chatGBT generated picture can be spoted clearly?,0,2,1775272876.0,hot
1sc2gyr,ChatGPT,This is genuinely terrifying,0,6,1775286360.0,hot
1sbnqs3,ChatGPT,The edit button is gone,5,5,1775245619.0,hot
1sc5qq6,ChatGPT,Very very disturbing,0,3,1775298360.0,hot
