id,subreddit,title,score,num_comments,created_utc,source
1sbdark,LocalLLaMA,I patched the open-source Claude Code reimplementation to actually work with Ollama and local models,25,26,1775222085.0,hot
1saoyj7,LocalLLaMA,Gemma 4 and Qwen3.5 on shared benchmarks,806,227,1775153250.0,hot
1sc1izn,LocalLLaMA,Running Gemma-4-E4B MLX version on MacBook M5 Pro 64 Mb - butter smooth,1,5,1775283049.0,hot
1sc55sc,LocalLLaMA,Seems that arena.ai has taken all Claude Opus models offline?,0,3,1775296266.0,hot
1sc1az9,LocalLLaMA,"Anyone solved agent retry side effects cleanly? I've been experimenting with ""action receipts""",1,0,1775282332.0,hot
1sbekgc,LocalLLaMA,Gemma 4 26B-A4B MoE running at 45-60 tok/s on DGX Spark — here's how,17,9,1775225175.0,hot
1sc0l5i,LocalLLaMA,Uploaded one of the more capable models for NVIDIA 128GB Blackwell configs,0,0,1775279914.0,hot
1sbeoka,LocalLLaMA,I’m surprised Nemotron OCR V2 isn’t getting more attention,17,6,1775225441.0,hot
1sav9wg,LocalLLaMA,"Gemma 4 is efficient with thinking tokens, but it will also happily reason for 10+ minutes if you prompt it to do so.",288,85,1775167505.0,hot
1sc0093,LocalLLaMA,Gemma-4 saves money,1,5,1775278046.0,hot
1sbzzo0,LocalLLaMA,What are your short test prompts? Here's mine,1,5,1775277993.0,hot
1sbpwo2,LocalLLaMA,Arena ai vs Benchmarks | Qwen 3.5 vs Gemma 4 models,4,16,1775250534.0,hot
1sbzsmt,LocalLLaMA,Built a frontend for claw-code-parity — trying to get it to feel like a real desktop AI workspace,1,0,1775277361.0,hot
1sbs3q6,LocalLLaMA,"Using LLMs - what, how, why?",4,14,1775255842.0,hot
1sc5tlc,LocalLLaMA,Tired of hitting Claude's limit because I use it for everything,0,3,1775298650.0,hot
1sbr7sx,LocalLLaMA,Has anyone run gemma 4 or Bonsai 8B models on Orange pi 5?,3,2,1775253636.0,hot
1sbju6u,LocalLLaMA,Gemma 4’s vision is kinda disappointing compared to Qwen3.5,8,8,1775236990.0,hot
1sb6l3l,LocalLLaMA,Ace Step 1.5 XL released,42,18,1775200282.0,hot
1sbi5sg,LocalLLaMA,"Has anyone here TRIED inference on Intel Arc GPUs? Or are we repeating vague rumors about driver problems, incompatibilities, poor support...",10,22,1775233287.0,hot
1saxvw2,LocalLLaMA,"Gemma 4 E4B + E2B Uncensored (Aggressive) — GGUF + K_P Quants (Multimodal: Vision, Video, Audio)",154,28,1775174090.0,hot
1sby5k6,LocalLLaMA,How do you decide?,1,4,1775272329.0,hot
1sbbin3,LocalLLaMA,"Gemma 4 E2B as a multi-agent coordinator: task decomposition, tool-calling, multi-turn — it works",18,5,1775217343.0,top
1sbbqyc,LocalLLaMA,Catching RAG hallucinations at inference time without LLM-as-a-judge (Local STS + NLI approach),9,0,1775217993.0,top
1sbf2sn,LocalLLaMA,Wiki Page,7,1,1775226373.0,top
1sbjmpm,LocalLLaMA,Gemma-4-31B vs. Qwen3.5-27B: Dense model smackdown,6,2,1775236538.0,top
1sbhp2e,LocalLLaMA,I tested 5 models and 13 optimizations to build a working AI agent on qwen3.5:9b,5,12,1775232269.0,top
1sbd0rc,LocalLLaMA,How we turned a small open-source model into the world's best AI forecaster,6,3,1775221379.0,top
1sbc8jb,LocalLLaMA,Gemma 4 4B vs Gemma 3 4B &amp; Qwen 3 4B in OCR,6,13,1775219352.0,top
1sbej6x,LocalLLaMA,"16x RT batched inference on L4, 18x improvement over upstream",5,4,1775225092.0,top
1sbiucs,LocalLLaMA,Usefulness of Lower Quant Models?,4,8,1775234844.0,top
1sbbwgn,LocalLLaMA,"Any GUIs/Tools to support all 1-bit, BitNet Mamba, RWKV, etc., similar type models?",5,5,1775218416.0,top
1sblpy6,LocalLLaMA,day 2: Comparison between gemma 4 q8 and qwen 3.5 122b Q4,3,8,1775241103.0,top
1sbgtd8,LocalLLaMA,Feedback on my hybrid local + cloud LLM architecture (llama.cpp + OpenRouter + MCP + RAG),3,0,1775230329.0,top
1sbrctx,LocalLLaMA,M5 Pro 64gb for LLM?,2,2,1775253977.0,top
1sbqynd,LocalLLaMA,Some advise or suggestions?,2,0,1775253019.0,top
1sbqgvr,LocalLLaMA,"Planning to make a Spanish variant of my model ""PicoLM"" (150M PARAMS)",2,1,1775251847.0,top
1sbpf86,LocalLLaMA,Best Gemma4 llama.cpp command switches/parameters/flags? Unsloth GGUF?,2,6,1775249419.0,top
1sbo87c,LocalLLaMA,How big model can be fine-tuned on RTX5080 vs RTX5090?,2,2,1775246718.0,top
1sbmdgg,LocalLLaMA,How to deeply ground my agent (agno) by facts?,2,11,1775242560.0,top
1sbklls,LocalLLaMA,Anyone able to get Gemma-4-e2b or Gemma-4-e4b to run on PocketPal iOS?,2,5,1775238657.0,top
1sbjzj6,LocalLLaMA,I'm trying to improve the accuracy of a 2B model without fine tuning,2,0,1775237312.0,top
1sbiui7,LocalLLaMA,Multi PSU &amp; GPU setup help!,2,0,1775234851.0,top
1sbh6ek,LocalLLaMA,Context Shift Gemma4,2,3,1775231121.0,top
1sbgj60,LocalLLaMA,"Memory, memory, memory... Any thoughts?",2,12,1775229697.0,top
1sbd5qa,LocalLLaMA,Gpus for a beginner.,2,6,1775221729.0,top
1sbxpp8,LocalLLaMA,OpenChamber UI not updating unless refresh after latest update,1,0,1775271070.0,top
1sbxabk,LocalLLaMA,[D] Reinforcement Learning from Epistemic Incompleteness? (RLEI) Would this work,1,0,1775269834.0,top
1sc1swj,LocalLLaMA,How are you handling web access for local models without destroying context quality?,0,3,1775283993.0,new
1sc0n1k,LocalLLaMA,Got ~19 tok/s with Gemma 4 on MacBook M4 16GB using MLX — here’s the setup I landed on,0,1,1775280098.0,new
1sbyjld,LocalLLaMA,I'm having issues with Gemma4...,0,1,1775273507.0,new
1sbyekg,LocalLLaMA,Qwen3.5 thinks a massacre occurred in Tiananmen Square in 1989,0,12,1775273073.0,new
1sbxtqr,LocalLLaMA,Which prompts do all AI models answer the exact same?,0,4,1775271399.0,new
1sbxhjz,LocalLLaMA,"Currently beating Opus on SWE-Bench using GLM + Minimax via Megaplan harness - 23 in, full 500 running",0,0,1775270415.0,new
1sbxe7z,LocalLLaMA,Made a CLI that makes 9b models beat 32b raw on code execution. pip install memla,0,4,1775270151.0,new
1sbwpsm,LocalLLaMA,[Question] Qwen3.5 on trainium GPU,1,0,1775268196.0,new
1sbtt2d,LocalLLaMA,Multi gpu connection help for server build,1,8,1775260226.0,new
1sbtkf0,LocalLLaMA,searching for yivon-alpha,0,3,1775259603.0,new
1sbt4bw,LocalLLaMA,Welp it was fun while it lasted...,0,29,1775258440.0,new
1sbsc0n,LocalLLaMA,Google should open-source Gemini 1.0 Pro like xAI did with Grok-1,0,10,1775256422.0,new
1sbs9mk,LocalLLaMA,Parakeet TDT v2 vs. V3?,1,5,1775256250.0,new
1sbs7a1,LocalLLaMA,Every LLM app crashes all the time,0,2,1775256080.0,new
1sbrhkx,LocalLLaMA,Seeking a free LLM API with high rate limits for a Discord bot Japanese support,1,6,1775254304.0,new
1sbrcyb,LocalLLaMA,Has anyone built a feedback loop where thumbs-down actually blocks the agent from repeating a mistake?,0,2,1775253987.0,new
1sbqnsz,LocalLLaMA,Gemma4 26B-A4B &gt; Gemma4 31B.  Qwen3.5 27B &gt; Qwen3.5 35B-A3B. Gemma4 26B-A4B &gt;= Qwen3.5  35-A3B. Current state. Tell me why I am right or wrong.,0,10,1775252302.0,new
1sbqaj7,LocalLLaMA,"How do I find LLMs that support RAG, Internet Search, Self‑Validation, or Multi‑Agent Reasoning?",0,5,1775251426.0,new
1sbpb3y,LocalLLaMA,What am i doing wrong? Can't seem to get more than 40t/s,1,4,1775249155.0,new
1sbogs9,LocalLLaMA,Just how powerful is Google’s Gemma 4?,0,11,1775247262.0,new
1sbmo03,LocalLLaMA,GEMMA 4 ON RTX 5050 LAPTOP,1,7,1775243196.0,new
1sbmn4c,LocalLLaMA,How can i override the Context limit in Claude Code for Qwen-3.6-plus via Openrouter.,1,3,1775243145.0,new
1sbma94,LocalLLaMA,"[observation/test] Gemma 4 being ""less restricted"" might be an anomaly that won't last.",0,6,1775242360.0,new
1sbly9k,LocalLLaMA,"Not a trick question, but a tricky question.",0,6,1775241624.0,new
