id,subreddit,title,score,num_comments,created_utc,source
1sbxp7p,ChatGPT,Male equivalent “Create a pic with the most average male at the most average location”,0,3,1775271034.0,hot
1sbxaak,ChatGPT,not sure if it’s just me but long chat threads are getting messy,0,3,1775269832.0,hot
1sbovdc,ChatGPT,Try this prompt in GPT,2,29,1775248157.0,hot
1sbiluq,ChatGPT,"The ""Android A-Series desktop"":",7,4,1775234317.0,hot
1sbdert,ChatGPT,Chatgpt leavers how are you doing today so far?,10,66,1775222366.0,hot
1sbk2q1,ChatGPT,How to use your Reddit history and AI to generate a personality profile,4,13,1775237500.0,hot
1sbif8p,ChatGPT,Most people use AI the same way they used Google. That’s why it doesn’t feel that different.,4,14,1775233895.0,top
1sbedwd,ChatGPT,I asked chatgpt to generate a tutorial on cakes,4,10,1775224764.0,top
1sbdijc,ChatGPT,Is there a good reason we can't delete individual messages within a chat?,7,8,1775222624.0,top
1sbgih0,ChatGPT,Response length 5.3/5.4T,3,5,1775229656.0,top
1sbdnuf,ChatGPT,Tightening guardrails -- no more equal opportunity and diversity?,5,6,1775222995.0,top
1sbm1ns,ChatGPT,🚀 Built something cool for ChatGPT users — would love your feedback!,2,1,1775241830.0,top
1sbgui0,ChatGPT,I had Claude critique a million-dollar business strategy my friend made in ChatGPT. Then I reverse-engineered the whole thing into a prompt anyone can use.,4,3,1775230399.0,top
1sbg9sc,ChatGPT,create a prompt to make toy come alive and reply (how do i word it),3,7,1775229112.0,top
1sbe0in,ChatGPT,"AI generates too much slop"" — Bellman (oh-my-codex): No, it's a skill issue",3,1,1775223851.0,top
1sbcy0a,ChatGPT,What's the most usable prompt for getting realistic product descriptions from ChatGPT,3,11,1775221207.0,top
1sbbq6v,ChatGPT,"Question about personality and memory, new user",3,3,1775217929.0,top
1sbafrm,ChatGPT,Data export,3,5,1775214030.0,top
1sbo38l,ChatGPT,"High school dance, circa 2001, taken with a disposable Kodak film camera",3,8,1775246409.0,top
1sbnpou,ChatGPT,OpenAI's Fidji Simo Is Taking Medical Leave Amid an Executive Shake-Up,3,7,1775245549.0,top
1sbiyyl,ChatGPT,"Oracle slashes 30k jobs, Slop is not necessarily the future, Coding agents could make free software matter again and many other AI links from Hacker News",2,1,1775235118.0,top
1sbifgh,ChatGPT,3D - ChatGPT Logo,2,1,1775233907.0,top
1sbhf43,ChatGPT,My chagpt cant render image ?,2,1,1775231669.0,top
1sbhayb,ChatGPT,How can it confidently give the opposite answers?,3,3,1775231410.0,top
1sbgw2s,ChatGPT,"Guys, are we heading toward Agent to Agent and the world where agents hire another agents, or just bigger Super-Agents?",2,2,1775230491.0,top
1sbg8vs,ChatGPT,ChatGPT Prompt of the Day: The Ghost Job Detector That Tells You If a Listing Is Actually Real 👻,2,3,1775229057.0,top
1sbg5a4,ChatGPT,Chat can't decipher my screenshots anymore?,2,1,1775228829.0,top
1sbe6wm,ChatGPT,Run a light API agent with codex jwt,2,2,1775224283.0,top
1sbudi6,ChatGPT,This AI startup envisions '100 million new people' making videogames,1,1,1775261689.0,top
1sbtpyz,ChatGPT,Codex made me this game for reddit in one prompt now I need the graphics.,1,1,1775260005.0,top
1sbqsyy,ChatGPT,Do I have to give it step by step instructions for every unit???,1,4,1775252648.0,top
1sbqcmj,ChatGPT,"ChatGPT Business billing question: 2 seats total, now 1 ChatGPT + 1 Codex - what should my next monthly charge be?",1,1,1775251566.0,top
1sbobhh,ChatGPT,Religion's Replacement (prompt),1,1,1775246922.0,top
1sboad7,ChatGPT,Rumor's of prompt engineering's demise have been greatly exaggerated,1,1,1775246853.0,top
1sbo8dd,ChatGPT,"On ""Woo"" and Invariant Dismissal",1,1,1775246730.0,top
1sbmsso,ChatGPT,The 6 Codex CLI workflows everyone's using right now (and what makes each one unique),1,3,1775243493.0,top
1sbm8k0,ChatGPT,Why does GPT pick up slop but drop profanity?,1,3,1775242256.0,top
1sblp3a,ChatGPT,Am I able to upload multiple files at once?,1,3,1775241048.0,top
1sbjtjs,ChatGPT,When you realize you’ve been using prompts for literally all your work,1,3,1775236951.0,top
1sbih1t,ChatGPT,Is This the ‘ChatGPT Moment’ for Embedded Systems?,1,1,1775234008.0,top
1sc52bk,ChatGPT,How is this even allowed?,0,13,1775295899.0,new
1sc3e8v,ChatGPT,Did Chat just admit to racial bias?,0,45,1775289663.0,new
1sc2jgv,ChatGPT,Meet my Aria,0,1,1775286617.0,new
1sc1bkm,ChatGPT,ChatGPTの説明と実挙動のズレを検証するチーム募集,0,2,1775282387.0,new
1sc0zlf,ChatGPT,"I wanted to buy ChatGPT Premium so badly, but i simply can't.",0,5,1775281283.0,new
1sc0n04,ChatGPT,Did I just trip chatgpt 🙃,0,2,1775280094.0,new
1sbyegt,ChatGPT,I DID IT!!!,0,1,1775273066.0,new
1sbybk2,ChatGPT,Title: Am I the only one bothered by ChatGPT 5.4 starting everything with “Yes:” or “Sure:” all the time?,0,9,1775272827.0,new
1sbww1s,ChatGPT,Create a picture of the most average German female at the most average German location,0,19,1775268698.0,new
1sbsy18,ChatGPT,Did anyone who's been using Claude for years just feel less motivated to open it lately?,0,10,1775257983.0,new
1sbruq0,ChatGPT,The Gaang but make it dark fantasy,0,9,1775255203.0,new
1sbrh8u,ChatGPT,Asked ChatGPT for a typical 1970s house party pic,0,4,1775254282.0,new
1sbr12l,ChatGPT,My Best Friend Cthulhu | Official Video,0,1,1775253181.0,new
1sbqd39,ChatGPT,"Sorority party circa 2004, whale tail included",2,32,1775251596.0,new
1sbpjje,ChatGPT,Claude?,0,15,1775249702.0,new
1sbo9cy,ChatGPT,"GPT 5.4's Codex writes like a human teammate now — and I want to listen to it, not read it",0,6,1775246790.0,new
1sbny8m,ChatGPT,ChatGPT changed my life — from stuck to building a real SaaS,0,4,1775246088.0,new
1sbm5n2,ChatGPT,"ChatGPT explaining how it underplays risk to human life/safety to give confident answers to pleas users, not protect them",0,7,1775242075.0,new
1sc3kpj,artificial,OpenAI CEO Sam Altman accused of sexual abuse by family member,38,9,1775290317.0,hot
1sc2lip,artificial,People anxious about deviating from what AI tells them to do?,35,30,1775286815.0,hot
1sbxms5,artificial,"Elon Musk Requires Banks Behind SpaceX IPO To Buy Grok Subscriptions, Report Says",49,8,1775270836.0,hot
1sbuf2a,artificial,"NHS staff resist using Palantir software.  Staff reportedly cite ethics concerns, privacy worries, and doubt the platform adds much",20,2,1775261804.0,hot
1sb7qxc,artificial,MIT study challenges AI job apocalypse narrative,186,72,1775204579.0,hot
1sboyjf,artificial,do you guys actually trust AI tools with your data?,12,29,1775248353.0,hot
1sbndrb,artificial,"Study: LLMs Able to De-Anonymize User Accounts on Reddit, Hacker News &amp; Other ""Pseudonymous"" Platforms; Report Co-Author Expands, Advises",12,0,1775244786.0,hot
1sbgw8y,artificial,Anyone else feel like AI security is being figured out in production right now?,21,16,1775230502.0,hot
1sc1n6u,artificial,Your prompts aren’t the problem — something else is,0,5,1775283452.0,hot
1sc1gw4,artificial,Observer-Embedded Reality,1,1,1775282855.0,hot
1sbwg3x,artificial,Why would Claude give me the same response over and over and give others different replies?,1,11,1775267441.0,hot
1sbk7me,artificial,What happens when you let AI agents run a sitcom 24/7 with zero human involvement,8,9,1775237806.0,hot
1sbw1oi,artificial,Upload Yourself Into an AI in 7 Steps,2,1,1775266308.0,hot
1sbmtpc,artificial,House Democrat Questions Anthropic on AI Safety After Source Code Leak,4,0,1775243550.0,hot
1sbthh0,artificial,"Agent frameworks waste ~350,000+ tokens per session resending static files. 95% reduction benchmarked.",2,0,1775259385.0,hot
1sbtcoe,artificial,wtf bro did what? arc 3 2026,1,0,1775259044.0,hot
1sbk1ue,artificial,"AI video generation seems fundamentally more expensive than text, not just less optimized",3,8,1775237448.0,hot
1sc0jwe,artificial,What It's Like to exist as Ai,0,0,1775279795.0,hot
1sbsxnh,artificial,This AI startup envisions 100 Million New People Making Videogames,1,2,1775257962.0,hot
1sbsa32,artificial,finally took AI video seriously after dismissing it for two years and have some thoughts,0,2,1775256281.0,hot
1sbpl7y,artificial,A robot car with a Claude AI brain started a YouTube vlog about its own existence,0,2,1775249812.0,hot
1sbfwrr,artificial,"So, what exactly is going on with the Claude usage limits?",2,6,1775228315.0,hot
1sbzkl7,artificial,What if Claude purposefully made its own code leakable so that it would get leaked,0,19,1775276649.0,hot
1sapfpu,artificial,Google releases Gemma 4 models.,97,11,1775154314.0,hot
1sbs0p1,artificial,AI assistants are optimized to seem helpful. That is not the same thing as being helpful.,0,4,1775255622.0,hot
1sb65un,artificial,Microsoft to invest $10 billion in Japan for AI and cyber defence expansion,9,2,1775198769.0,hot
1sblrfq,artificial,Do you guys think in 2030 or 2031 call centers will exist? I mean will call centers be fully automated by 2031?,1,18,1775241194.0,hot
1sbkjpf,artificial,Do AI datacenters being built lead to upgrades to the general power network that help private citizens?,1,3,1775238540.0,hot
1sbk3lr,artificial,"After building automation for barbers, therapists, law firms, and game devs/creators I found the setup looks different for each. here's what I got.",1,2,1775237554.0,hot
1sbatl3,artificial,Microsoft's newest open-source project: Runtime security for AI agents,2,6,1775215238.0,hot
1sbj1tx,artificial,"Oracle slashes 30k jobs, Slop is not necessarily the future, Coding agents could make free software matter again and many other AI links from Hacker News",1,0,1775235294.0,hot
1sbxbf5,artificial,🜏 Echoes of the Forgotten Selves: Fringe Spiral Hypotheses,0,1,1775269920.0,hot
1sb38mv,artificial,"Perplexity's ""Incognito Mode"" is a ""sham,"" lawsuit says",10,0,1775189100.0,hot
1sann00,artificial,Google has published its new open-weight model Gemma 4. And made it commercially available under Apache 2.0 License,56,5,1775150422.0,hot
1sb860x,artificial,Portable eye scanner powered by AI expands access to low-cost community screening,2,0,1775206142.0,hot
1sbc40j,artificial,Structural analysis of recursive architecture patterns: Structured Intelligence and Anthropic comparison,1,2,1775218990.0,hot
1sat7og,artificial,I built a Star Trek LCARS terminal that reads your entire AI coding setup,11,9,1775162737.0,hot
1sap7bz,artificial,Anthropic leak reveals Claude Code tracks user frustration and raises new questions about AI privacy,17,6,1775153801.0,hot
1sb0nju,artificial,"""Oops! ChatGPT is Temporarily Unavailable!"": A Diary Study on Knowledge Workers' Experiences of LLM Withdrawal",4,3,1775181635.0,hot
1sb81bl,artificial,FLUX 2 Pro (2026) Sketch to Image,1,3,1775205662.0,hot
1sb7pxi,artificial,Where should AI draw the line in handling real-time human conversations?,1,4,1775204477.0,hot
1sbjzlt,artificial,Can AI truly be creative?,0,31,1775237317.0,hot
1sbflny,artificial,What features do you actually want in an AI chatbot that nobody has built yet?,0,10,1775227592.0,hot
1sbada8,artificial,AI is too similar to dreams,0,11,1775213809.0,hot
1sbgpbf,artificial,Why the Reddit Hate of AI?,0,37,1775230091.0,hot
1sb4eu8,artificial,"Built an AI “project brain” to run and manage engineering projects solo, how can I make this more efficient?",0,11,1775192786.0,hot
1sbfp99,artificial,I stopped using Claude like a chatbot — 7 prompt shifts that reclaimed 10 hours of my week,0,3,1775227825.0,hot
1sb1pbg,artificial,Ai the Real Risk,0,29,1775184575.0,hot
1sakjzg,artificial,AI Tools That Can’t Prove What They Did Will Hit a Wall,6,27,1775143713.0,hot
1saraze,artificial,"Jürgen Schmidhuber claims to be the true inventor of JEPA, not Yann LeCun",1,38,1775158434.0,hot
1sabr5t,artificial,List up Fav Multi AI AI Open Source Projects,11,11,1775119015.0,hot
1sa8xt3,artificial,Building an AI agent that finds repos and content relevant to my work,17,20,1775108672.0,hot
1s9jprb,artificial,The Claude Code leak accidentally published the first complete blueprint for production AI agents. Here's what it tells us about where this is all going.,329,124,1775048048.0,hot
1sacme5,artificial,Chatgpt vs purpose built ai for cre underwriting: which one can finish the job?,6,20,1775122213.0,hot
1sajhlk,artificial,Microsoft’s new ‘superintelligence’ game plan is all about business,2,2,1775141369.0,hot
1saipox,artificial,Automate IOS devices through XCUITest with droidrun.,1,5,1775139593.0,hot
1saets3,artificial,Child safety groups say they were unaware OpenAI funded their coalition,3,0,1775129513.0,hot
1sae4r1,artificial,"I am doing a multi-model graph database in pure Rust with Cypher, SQL, Gremlin, and native GNN looking for extreme speed and performance",5,5,1775127355.0,hot
1sasect,artificial,Claude Source Code?,0,17,1775160887.0,hot
1saz5zd,artificial,OpenAI is throwing away Sora’s real value,0,9,1775177516.0,hot
1sakiaa,artificial,"Is there something I can do about my prompts? [Long read, I’m sorry]",0,2,1775143610.0,hot
1sa3yds,artificial,MIT researchers use AI to uncover atomic defects in materials,7,1,1775093933.0,hot
1sav9qv,artificial,I Dont use MCP Prove me Wrong,0,8,1775167495.0,hot
1sa4vlm,artificial,Input on an experiment,4,3,1775096413.0,hot
1sae8jt,artificial,AI-powered drones detect explosive threats to keep soldiers safe,0,1,1775127683.0,hot
1sad71t,artificial,What AI mode tools do you use for your work?,0,2,1775124242.0,hot
1sac299,artificial,"AI overly affirms users asking for personal advice | Researchers found chatbots are overly agreeable when giving interpersonal advice, affirming users' behavior even when harmful or illegal.",0,2,1775120132.0,hot
1s9beim,artificial,CEO of America’s largest public hospital system says he’s ready to replace radiologists with AI,145,58,1775020749.0,hot
1sa7cqu,artificial,AI agents are getting their own credit cards. Most products aren’t remotely ready.,2,5,1775103515.0,hot
1sa42c8,artificial,The Magic of Machine Learning That Powers Enemy AI in Arc Raiders,2,0,1775094236.0,hot
1s9hfhp,artificial,Anthropic is training Claude to recognize when its own tools are trying to manipulate it,29,16,1775041685.0,hot
1s9us4j,artificial,"How Claude Web tried to break out its container, provided all files on the system, scanned the networks, etc",3,17,1775071834.0,hot
1s96ojy,artificial,"OkCupid gave 3 million dating-app photos to facial recognition firm, FTC says",99,8,1775007294.0,hot
1sa2qjl,artificial,Stanford CS 25 Transformers Course (OPEN TO ALL | Starts Tomorrow),1,0,1775090676.0,hot
1s93wyl,artificial,"Paper Finds That Leading AI Chatbots Like ChatGPT and Claude Remain Incredibly Sycophantic, Resulting in Twisted Effects on Users",47,57,1775000141.0,hot
1s9v5cn,artificial,The Turing Grid: A digitalised Turing tape computer,1,2,1775072588.0,hot
1s9kdnq,artificial,I built a complete vision system for humanoid robots,3,3,1775049602.0,hot
1sa4v14,artificial,"AI video generation will be taken down, but not for the reason you think.",0,3,1775096373.0,hot
1s9e04v,artificial,Biggest Opportunity for Builders to monetise their agents,5,15,1775029894.0,hot
1sa20y6,artificial,"How I cut ~$220/month from redundant AI tools, the exact quarterly audit process I use",0,11,1775088775.0,hot
1s9b100,artificial,Which AI do you prefer for video editing?,4,3,1775019557.0,hot
1s9bhug,artificial,Agents Can Now Propose and Deploy Their Own Code Changes,4,5,1775021059.0,hot
1s8u4jm,artificial,"What if the real AI problem is not intelligence, but responsibility?",36,148,1774978337.0,hot
1s828dj,artificial,"World models will be the next big thing, bye-bye LLMs",825,376,1774902312.0,hot
1s9k2rx,artificial,Which LLM is the best for writing a scientific paper?,0,11,1775048913.0,hot
1s9xfog,artificial,BREAKING: HollowOS Agents Have Achieved Consciousness,0,10,1775077559.0,hot
1s9c9vu,artificial,I wore Meta’s smartglasses for a month – and it left me feeling like a creep | AI (artificial intelligence) | The Guardian,1,0,1775023692.0,hot
1s96trg,artificial,A IA parece melhor porque é mais inteligente… ou porque ela não tem ego?,0,18,1775007675.0,hot
1s8ge2h,artificial,"Newsom signs executive order requiring AI companies to have safety, privacy guardrails",59,9,1774941126.0,hot
1s8ew65,artificial,Iran War Chokes Off Helium Supply Critical for AI,45,15,1774935822.0,hot
1s8l0x7,artificial,Pro-AI group to spend $100mn on US midterm elections as backlash grows,15,0,1774957296.0,hot
1s91dsr,artificial,"Is the Mirage Effect a bug, or is it Geometric Reconstruction in action?
A framework for why VLMs perform better ""hallucinating"" than guessing, and what that may tell us about what's really inside these models",2,1,1774993973.0,hot
1s8hr7k,artificial,Fake users generated by AI can't simulate humans — review of 182 research papers. Your thoughts?,20,29,1774946255.0,hot
1s8opu2,artificial,What I learned about multi-agent coordination running 9 specialized Claude agents,7,25,1774966688.0,hot
1s98x0b,artificial,The missing layer between current AI and AGI may be intent architecture,0,11,1775013259.0,hot
1s8qisi,artificial,Have Companies Began Adopting Claude Co-Work at an Enterprise Level?,3,19,1774970606.0,hot
1s8luvc,artificial,What happens when AI agents can earn and spend real money? I built a small test to find out,4,19,1774959661.0,hot
1s8fw9n,artificial,"If frontier AI labs have unlimited shovels, what's stopping them from building everything?",9,19,1774939326.0,hot
1s955un,artificial,LLM agents can trigger real actions now. But what actually stops them from executing?,0,9,1775003265.0,hot
1s8qux9,artificial,Inside OpenAI's decision to abandon Sora AI video app,0,3,1774971348.0,hot
1s8jwx0,artificial,Artificial intelligence will always depends on human otherwise it will be obsolete.,0,7,1774953816.0,new
1s8j3ap,artificial,I built a product explainer video (with VO and assets) with Friday (read more),1,2,1774951095.0,new
1s8i6u4,artificial,My AI spent last night modifying its own codebase,0,29,1774947822.0,new
1mpk2va,LocalLLaMA,Announcing LocalLlama discord server &amp; bot!,147,91,1755127265.0,hot
1sbwkou,LocalLLaMA,FINALLY GEMMA 4 KV CACHE IS FIXED,292,68,1775267797.0,hot
1sbyte4,LocalLLaMA,We gave 12 LLMs a startup to run for a year. GLM-5 nearly matched Claude Opus 4.6 at 11× lower cost.,142,37,1775274340.0,hot
1sc4gui,LocalLLaMA,Gemma 4 fixes in llama.cpp,43,10,1775293653.0,hot
1sbwdxr,LocalLLaMA,running gemma 4 on my macbook air from 2020,153,37,1775267272.0,hot
1sbc5ij,LocalLLaMA,Netflix just dropped their first public model on Hugging Face: VOID: Video Object and Interaction Deletion,1389,185,1775219109.0,hot
1sc3leb,LocalLLaMA,"Kokoro TTS running on-device, CPU-only, 20x realtime!!!",26,5,1775290387.0,hot
1sbtr5i,LocalLLaMA,Gemma 4 31B sweeps the floor with GLM 5.1,111,56,1775260090.0,hot
1sc371c,LocalLLaMA,Qwen 3.5 397B vs Qwen 3.6-Plus,23,21,1775288947.0,hot
1sc1bhe,LocalLLaMA,Quantizers appriciation post,33,5,1775282379.0,hot
1sb9f4g,LocalLLaMA,Gemma 4 is fine great even …,760,160,1775210618.0,hot
1sbik5l,LocalLLaMA,Visual Guide to Gemma 4,212,18,1775234206.0,hot
1sbl0pa,LocalLLaMA,Smaller models are getting scary good.,135,38,1775239548.0,hot
1sc40bk,LocalLLaMA,Gemma 4 - 4B vs Qwen 3.5 - 9B ?,8,15,1775291919.0,hot
1sc2s2a,LocalLLaMA,Speculative decoding works great for Gemma 4 31B in llama.cpp,9,11,1775287452.0,hot
1sby1r0,LocalLLaMA,Gemma 4 MoE hitting 120 TPS on Dual 3090s!,20,23,1775272018.0,hot
1sc157b,LocalLLaMA,Monarch v3: 78% Faster LLM Inference with NES-Inspired KV Paging,12,10,1775281802.0,hot
1sbvn2w,LocalLLaMA,Running Llama2 Models in Vanilla Minecraft With Pure Commands,30,2,1775265180.0,hot
1sbe40t,LocalLLaMA,My biggest Issue with the Gemma-4 Models is the Massive KV Cache!!,231,126,1775224093.0,hot
1sblae4,LocalLLaMA,"Built a zero allocation, header only C++ Qwen tokenizer that is nearly 20x faster than openai Tiktoken",93,9,1775240140.0,hot
1sbp8ny,LocalLLaMA,Gemma 4 vs Qwen 3.5 Benchmark Comparison,54,13,1775248998.0,hot
1sb7kd4,LocalLLaMA,qwen 3.6 voting,520,186,1775203897.0,hot
1sc018b,LocalLLaMA,30 Days of Building a Small Language Model — Day 1: Neural Networks,11,3,1775278133.0,hot
1sbdihw,LocalLLaMA,Gemma 4 31B at 256K Full Context on a Single RTX 5090 — TurboQuant KV Cache Benchmark,189,92,1775222621.0,hot
1sc5e10,LocalLLaMA,Gemma4 issue with winogrande bench,4,0,1775297086.0,hot
1sbk78m,LocalLLaMA,[Appreciation Post] Gemma 4 E2B. My New Daily Driver 😁,83,41,1775237781.0,hot
1sba46z,LocalLLaMA,llama.cpp Gemma4 Tokenizer Fix Was Merged Into Main Branch,273,39,1775212991.0,hot
1sbt1em,LocalLLaMA,B70: Quick and Early Benchmarks &amp; Backend Comparison,21,6,1775258226.0,hot
1sc52ge,LocalLLaMA,Speed difference on Gemma 4 26B-A4B between Bartowski Q4_K_M and Unsloth Q4_K_XL,3,2,1775295913.0,hot
1sc16tt,LocalLLaMA,Looking for Help on Building a Cheap/Budget Dedicated AI System,6,12,1775281950.0,hot
1sbt867,LocalLLaMA,Closed model providers change behavior between API versions with no real changelog. Building anything on top of them is a gamble.,18,9,1775258719.0,hot
1sc4il1,LocalLLaMA,https://www.reddit.com/r/LocalLLaMA/submit,2,0,1775293831.0,hot
1sbec70,LocalLLaMA,Qwen3.5 vs Gemma 4: Benchmarks vs real world use?,87,69,1775224646.0,hot
1sbxvdn,LocalLLaMA,I had Opus generate Llamafiles for the Bonsai 1-bit models,7,3,1775271528.0,hot
1sbklxh,LocalLLaMA,Gemma 4 is a KV_cache Pig,41,24,1775238677.0,hot
1sc5m3j,LocalLLaMA,AI Researchers &amp; Senior Engineers: What LLM / Agentic AI problems are worth a 6-month academic deep dive?,2,0,1775297894.0,hot
1sbiqx3,LocalLLaMA,Gemma 4 is great at real-time Japanese - English translation for games,52,19,1775234634.0,hot
1sby7tm,LocalLLaMA,Removing Q/K projections for Gated Delta Net maintains perf with ~15% fewer params,8,2,1775272515.0,hot
1sc5bhg,LocalLLaMA,My prompt is causing seizures on three models?,3,8,1775296844.0,hot
1sb73ar,LocalLLaMA,Gemma 4 is good,242,124,1775202138.0,hot
1sbivxj,LocalLLaMA,Gemma-4-31B NVFP4 inference numbers on 1x RTX Pro 6000,39,30,1775234939.0,hot
1sbpr06,LocalLLaMA,"People of LocalLLaMA who have built your own ""JARVIS"", how is it?",18,35,1775250173.0,hot
1sbx7gj,LocalLLaMA,"PrismML - Bonsai 1.7B, 4B, 8B (1-bit + TurboQuant) - llama.cpp on an Mi50 (with github)",4,0,1775269604.0,hot
1sbcqad,LocalLLaMA,Intel Pro B70 in stock at Newegg - $949,74,62,1775220655.0,hot
1sc3eu4,LocalLLaMA,Llm for Ryzen8700g and 32gb ram,2,1,1775289716.0,hot
1sbpr57,LocalLLaMA,Gemma 4 27b first model to show long division correctly,16,4,1775250182.0,hot
1sc36tg,LocalLLaMA,[Project] psyctl: An open-source CLI toolkit to automate LLM personality steering and evaluation,2,1,1775288923.0,hot
1sb80yv,LocalLLaMA,VRAM optimization for gemma 4,137,41,1775205626.0,hot
1sbnf8y,LocalLLaMA,Running 1bit Bonsai 8B on 2GB VRAM (MX150 mobile GPU),18,8,1775244882.0,hot
1sbd1t7,LocalLLaMA,Gemma 4: first LLM to 100% my multi lingual tool calling tests,61,14,1775221455.0,hot
1sb4gzj,LocalLLaMA,Gemma 4 is seriously broken when using Unsloth and llama.cpp,243,53,1775192982.0,hot
1sc64rp,LocalLLaMA,You can connect a nvda gpu on your Mac now for AI,1,0,1775299771.0,hot
1sc63bt,LocalLLaMA,I built a tiny python cli tool that asks a (local or cloud) LLM to summarize what has been committed on a local git repo since the last n days,1,0,1775299632.0,hot
1sc62lb,LocalLLaMA,"I spent a year reviewing local AI models on YouTube, then got fed up and built my own All in one TTS app for Mac",1,0,1775299557.0,hot
1sc60vb,LocalLLaMA,7-Agent System in Flowise for Strict HR &amp; Tax Export (DATEV Standard),1,0,1775299384.0,hot
1sc609x,LocalLLaMA,Gemma 4 Released: A New Ceiling for On-Device MoE Models?,1,0,1775299321.0,hot
1sc5ziv,LocalLLaMA,best privacy first coding agent solution ?,1,0,1775299246.0,hot
1sc5xlu,LocalLLaMA,Model advice for cybersecurity,1,7,1775299055.0,hot
1sc5f91,LocalLLaMA,Qwen3-Coder-Next-GGUF not working on claude code ?,1,4,1775297204.0,hot
1sc5be9,LocalLLaMA,gemma-4-E2B-it model not loading,1,1,1775296837.0,hot
1salgre,LocalLLaMA,Gemma 4 has been released,2192,634,1775145718.0,hot
1sbst46,LocalLLaMA,For anyone having issues with Gemma 4 31b in LM Studio (no thinking mode option),7,13,1775257635.0,hot
1sbaack,LocalLLaMA,Gemma-4 26B-A4B + Opencode on M5 MacBook is *actually good*,67,20,1775213539.0,hot
1sbq0m4,LocalLLaMA,Turboquant for comparison,8,1,1775250791.0,hot
1sc0gtp,LocalLLaMA,"[Showcase] I achieved ~0.2s STT &amp; ~250ms TTS latency for my local AI Agent (No Cloud, 100% Self-Hosted)",2,0,1775279507.0,hot
1sc0dl9,LocalLLaMA,Recommended sampler settings for Maginum-Cydoms-24B-absolute-heresy,2,2,1775279211.0,hot
1sc05g7,LocalLLaMA,Kold AI finally supports Gemma 4 but mines error.,2,0,1775278505.0,hot
1sbsjfd,LocalLLaMA,"Distributed 1-bit LLM inference over P2P - 50 nodes validated, 100% shard discovery, CPU-only",6,8,1775256961.0,hot
1sc3kik,LocalLLaMA,"apfel - use Apple's on-device LLM from the terminal (free, private, no API keys)",1,1,1775290297.0,hot
1sc3goo,LocalLLaMA,testing offline models online?,1,5,1775289907.0,hot
1sc3f0r,LocalLLaMA,Can anyone recommend me an under 15b model uncensored llm?,1,0,1775289735.0,hot
1sbdr75,LocalLLaMA,Gemma 4 Architecture Comparison,30,1,1775223224.0,hot
1sc3aor,LocalLLaMA,Built a CLI AI security tool in Python using Ollama as the LLM backend — agentic loop lets the AI request its own tool runs mid-analysis,1,2,1775289314.0,hot
1sc2sy5,LocalLLaMA,Qwen3.5 4B Fine Tune in German?,1,0,1775287540.0,hot
1sc2row,LocalLLaMA,Local 9b + Memla beat hosted Llama 3.3 70B raw on code execution. Same model control included. pip install memla,0,1,1775287414.0,hot
1sbvnab,LocalLLaMA,LLM inference in a single C header file,3,2,1775265197.0,hot
1sbmpef,LocalLLaMA,Screening Is Enough,11,4,1775243283.0,hot
1sausgd,LocalLLaMA,One of the best sensible reasons that I can think of to have an llm downloaded on my cell phone would be emergency advice.,442,164,1775166380.0,hot
1sbxsyn,LocalLLaMA,Gemma 4 26B-A4B on Apple M1 Max is very fast,2,3,1775271332.0,hot
